{"$schema":"./challenger-replacement-v3-partial-install-recovery-plan-v1.schema.json","authority":{"broker_requests_allowed":false,"credential_access_allowed":false,"fund_movement_allowed":false,"orders_allowed":false,"private_account_requests_allowed":false,"production_activation":false,"replacement_start_authorized":false,"runtime_install_authorized":false},"candidate":{"recovery_receipt_root":"/Users/chenm4/Library/Application Support/CryptoQuant/challenger-replacement-v1/deployment/partial-install-recovery-receipts-v0.78.7","release_tag":"v0.78.7","target_plist":"/Users/chenm4/Library/LaunchAgents/local.crypto-quant.challenger-replacement-v1-v0.78.7.plist"},"empty_directories":{"event_root":{"ctime_ns":"1787981014554882704","device":"16777233","entry_names":[],"entry_names_hash":"4f53cda18c2baa0c0354bb5f9a3ecbe5ed12ab4d8e11ba873c2f11161202b945","inode":"27114721","link_count":2,"mode":448,"mtime_ns":"1787981014554873120","owner_uid":501,"path":"/Users/chenm4/Library/Application Support/CryptoQuant/challenger-replacement-v1/state/challenger-replacement-events-v1","size_bytes":64},"log_root":{"ctime_ns":"1787981014554995580","device":"16777233","entry_names":[],"entry_names_hash":"4f53cda18c2baa0c0354bb5f9a3ecbe5ed12ab4d8e11ba873c2f11161202b945","inode":"27114724","link_count":2,"mode":448,"mtime_ns":"1787981014554984121","owner_uid":501,"path":"/Users/chenm4/Library/Application Support/CryptoQuant/challenger-replacement-v1/log","size_bytes":64},"start_receipt_root":{"ctime_ns":"1787981014554958079","device":"16777233","entry_names":[],"entry_names_hash":"4f53cda18c2baa0c0354bb5f9a3ecbe5ed12ab4d8e11ba873c2f11161202b945","inode":"27114723","link_count":2,"mode":448,"mtime_ns":"1787981014554948496","owner_uid":501,"path":"/Users/chenm4/Library/Application Support/CryptoQuant/challenger-replacement-v1/evidence/start-receipts","size_bytes":64},"state_parent":{"ctime_ns":"1787981014554873954","device":"16777233","entry_names":["challenger-replacement-events-v1"],"entry_names_hash":"a2e793c8a040f26fa9d9458af964b6829c108f280ceff5ad3e6a5292416f73fc","inode":"27114720","link_count":3,"mode":448,"mtime_ns":"1787981014554873954","owner_uid":501,"path":"/Users/chenm4/Library/Application Support/CryptoQuant/challenger-replacement-v1/state","size_bytes":96}},"foundation":{"manifest_file_sha256":"f06bbfa5dba81cd9f713c4d6b51bbd403d67439b063fdfe1f5b7fe49ae0f5cea","manifest_hash":"808c2fd2aefbfc363725f0cf2a46a74cfc56a538e284dce6fd62042d475ea477","manifest_version":"1.78.0","package_version":"0.78.6","peeled_commit":"faf6e03632c21dba0894f0a1248f308306b13737","release_tag":"v0.78.6","repository":"cjl308868584-lang/crypto-quant-core","tag_object":"bc78d140129a23b38d3c72c1f4a93d8df568275e","visibility":"PUBLIC"},"incident":{"failed_install_receipt_id":"challenger_replacement_v3_activation_install_1360395f65ff586b76dc0c430c3e724046c93a32de55dd6293072f210bbca5cf","preflight_receipt_id":"challenger_replacement_v3_activation_preflight_ffe13b514e31d92e6b8c7cec26a444a23ad6dd16ea9fae66b59c04c42454cfee","preservation_policy":"IMMUTABLE_READ_ONLY_NO_REPAIR","reason_code":"INSTALL_RECEIPT_CANONICAL_TIMESTAMP_REPLAY_FAILED","release_tag":"v0.78.5"},"plan_hash":"62a873b0411b1490ccfa525184abc430942a57ffc514bc9ac87ad87016164fa0","plan_id":"challenger_replacement_v3_partial_install_recovery_plan_2daf5e65cb5bae3d8219cfe3d884da79d9fa1e377e9c2b5f1126e723e2f85935","preserved_files":{"candidate_plist":{"ctime_ns":"1788094333906436132","device":"16777233","inode":"28345099","link_count":1,"mode":384,"mtime_ns":"1788094333906258632","owner_uid":501,"path":"/Users/chenm4/Library/Application Support/CryptoQuant/challenger-replacement-v1/deployment/local.crypto-quant.challenger-replacement-v1-v0.78.5.plist","sha256":"30efabbd76ab5af9c277213b3377612b5119a7889c6b8165748dbcc36acd329b","size_bytes":3994},"failed_install_receipt":{"ctime_ns":"1788106446102116127","device":"16777233","inode":"28400732","link_count":1,"mode":384,"mtime_ns":"1788106446101743460","owner_uid":501,"path":"/Users/chenm4/Library/Application Support/CryptoQuant/challenger-replacement-v1/deployment/install-receipts-v0.78.5/challenger_replacement_v3_activation_install_1360395f65ff586b76dc0c430c3e724046c93a32de55dd6293072f210bbca5cf.json","sha256":"97747c0ebd2f49c3afe875e9a1f99d541d98e363ac457e767a622586f8523198","size_bytes":3536},"install_contract":{"ctime_ns":"1788094333906787632","device":"16777233","inode":"28345100","link_count":1,"mode":384,"mtime_ns":"1788094333906665632","owner_uid":501,"path":"/Users/chenm4/Library/Application Support/CryptoQuant/challenger-replacement-v1/deployment/challenger-replacement-v3-install-contract-v0.78.5.json","sha256":"03d6cf60e51ebe87d5a81d8f45d33d8e39d4074bf57b6bd450c4b5cdfbd026af","size_bytes":7716},"predecessor_plist":{"ctime_ns":"1785225670104072295","device":"16777233","inode":"13229927","link_count":1,"mode":384,"mtime_ns":"1785225670103701526","owner_uid":501,"path":"/Users/chenm4/Library/LaunchAgents/local.crypto-quant.challenger-forward.plist","sha256":"f6b2283ad4c01ee6e7dc8e954bdcb29dd221d5b79d4a04b69618af1d26182b53","size_bytes":2409},"preflight_receipt":{"ctime_ns":"1788106370887602828","device":"16777233","inode":"28400661","link_count":1,"mode":384,"mtime_ns":"1788106370886738162","owner_uid":501,"path":"/Users/chenm4/Library/Application Support/CryptoQuant/challenger-replacement-v1/deployment/preflight-receipts-v0.78.5/challenger_replacement_v3_activation_preflight_ffe13b514e31d92e6b8c7cec26a444a23ad6dd16ea9fae66b59c04c42454cfee.json","sha256":"3440beab833c998a3d0c250e60fd2f6876f4aa206c0e5c609a772d4333a59ce5","size_bytes":3768},"target_plist":{"ctime_ns":"1788106445351350194","device":"16777233","inode":"28400729","link_count":1,"mode":384,"mtime_ns":"1788106445350995444","owner_uid":501,"path":"/Users/chenm4/Library/LaunchAgents/local.crypto-quant.challenger-replacement-v1.plist","sha256":"30efabbd76ab5af9c277213b3377612b5119a7889c6b8165748dbcc36acd329b","size_bytes":3994}},"required_state":{"automation_id":"v0-78-3-replacement","automation_path":"/Users/chenm4/.codex/automations/v0-78-3-replacement/automation.toml","automation_status":"PAUSED","launchctl_domain":"gui/501","service_labels":["local.crypto-quant.challenger-forward","local.crypto-quant.challenger-replacement-v1"],"service_state":"DISABLED_AND_NOT_LOADED"},"schema_version":"1.0.0","snapshot":{"file_count":101,"root_record":{"ctime_ns":"1788094333384556282","device":"16777233","entry_names":["artifacts","src","vendor"],"entry_names_hash":"67ef46fac8ec9806928af5b57286b8d95d7ef1080d4bef602e68e8b5546eb490","inode":"28344985","link_count":5,"mode":448,"mtime_ns":"1788094333382848241","owner_uid":501,"path":"/Users/chenm4/Library/Application Support/CryptoQuant/challenger-replacement-v1/deployment/snapshots/b5ac484d5b7b8e61d36c33b7cc686fda23a79524734167158123720b2c14cfbe","size_bytes":160},"total_size_bytes":3248480,"tree_hash":"b5ac484d5b7b8e61d36c33b7cc686fda23a79524734167158123720b2c14cfbe"},"status":"PARTIAL_INSTALL_RECOVERY_PLAN_FROZEN_NOT_EXECUTED"}